,Time,User,Tweet
0,2022-12-10 14:08:11+00:00,kato__shinya,It makes no sense that our good accounts are being banned without the blatantly pornographic accounts being banned.
1,2022-12-10 14:06:19+00:00,kato__shinya,"If #shadowban's conditions could be visualized on #Twitter, it would eliminate the need for some of the services th… https://t.co/NkXTaSz91p"
2,2022-12-10 14:03:56+00:00,IAmSteveHarvey,Don’t let that set back be your fall back. STAND UP!!!!! YOU GOT THIS!!!!
3,2022-12-10 14:03:47+00:00,kato__shinya,"Although, I do think that super simple and addictive games like #FlappyBird are better suited for mobile"
4,2022-12-10 14:02:08+00:00,kato__shinya,And the simple battle systems of these legendary #games are still in use and work well in modern #MobileApp games.
5,2022-12-10 14:00:49+00:00,CBP,https://t.co/ne8m20Dth6
6,2022-12-10 14:00:23+00:00,kato__shinya,"This was the battle system used in early blockbusters such as #Pokemon, #DragonQuest and etc, a simple yet highly addictive system."
7,2022-12-10 14:00:08+00:00,DeptofDefense,What time is it? Game Time! The @ArmyNavyGame is today in Philadelphia! Who will you be cheering for? Go @USArmy or… https://t.co/5ps8KnS3I3
8,2022-12-10 13:57:36+00:00,kato__shinya,"And I felt that a battle system in a #2D #game, in which certain monsters are encountered on the map at a certain p… https://t.co/N2U9AEmNfY"
9,2022-12-10 13:55:26+00:00,kato__shinya,I feel #GameProgramming is really #creative
10,2022-12-10 13:30:01+00:00,InsideTracker,"""Knowing what’s going on inside your body has never been more accessible with mobile blood draw."" - Dean K.

With M… https://t.co/NwQ6MBJjuP"
11,2022-12-10 12:27:06+00:00,grok_,Met @leppert on Twitter 10 years ago https://t.co/EhwzOy3NgF
12,2022-12-10 12:23:09+00:00,wonderofscience,"Starfish walk using hundreds of tiny tube feet on the underside of their arms, as seen in this fascinating timelaps… https://t.co/fZzDGRcwye"
13,2022-12-10 12:00:22+00:00,FBI,The #FBI's latest Violent Crime Case Round-Up is now live on our website. Visit this link to read more:… https://t.co/1HEwBwOIZO
14,2022-12-10 12:00:00+00:00,DeptofDefense,NEWS: DoD Prepares for U.S.-Africa Summit https://t.co/5MxkRlIBSK
15,2022-12-10 11:44:10+00:00,kato__shinya,"Hi Dear @elonmusk , #Twitter should create a verification system for #domain owners. As you know, domain names are… https://t.co/SrNnnKAgkU"
16,2022-12-10 10:46:09+00:00,balajis,"So, the journos are trying to doxx people who were already robbed.

But are they pushing to find out where the stol… https://t.co/tzlNy4Syhu"
17,2022-12-10 10:35:05+00:00,balajis,"This makes it even more obvious for those slow on the uptake.

If the journos wanted to get SBF, they’d do that.

I… https://t.co/07FXHky7NY"
18,2022-12-10 09:43:43+00:00,balajis,"Social media trained AI.

First it was called a fad, a bubble, a triviality.

Then it became a “threat to democracy… https://t.co/3NPvLOBKxu"
19,2022-12-10 09:27:14+00:00,jakeshieldsajj,"John Podesta's niece and doctors Fauci’s daughter both worked at Twitter 

Its almost feels as if there's a conspir… https://t.co/8Gjz24tyQs"
